{
  "$schema": "./acceptance-manifest.schema.json",
  "manifest_version": "acceptance-manifest-v1",
  "acceptance_id": "monotone-calibrate-acceptance-v1",
  "decision_boundary": {
    "wayfinder_deliverable": "Freeze executable requirements, fixtures, oracles, tolerances and handoff gates without claiming production execution.",
    "implementation_deliverable": "Build the separate source project, keep this frozen design manifest at NOT_RUN, retain PASS evidence for every listed gate, and publish a separately verified acceptance-results-v1 aggregate on the required platforms.",
    "zero_blocker_rule": true,
    "production_acceptance_claimed_here": false
  },
  "parser_policy": {
    "policy_id": "csv-parser-v1",
    "file_bytes_max_inclusive": 10485760,
    "file_bytes_measure": "raw regular-file snapshot including an optional UTF-8 BOM",
    "data_records_max_inclusive": 10000,
    "record_definition": "CSV logical data records after the one header record; physically blank lines are ignored; a quoted newline remains inside one logical record",
    "header_counts_as_data_record": false,
    "columns_max_inclusive": 256,
    "column_rule": "header field count and every nonblank logical data-record field count must be equal and at most 256",
    "field_bytes_max_inclusive": 65536,
    "field_bytes_measure": "UTF-8 byte length after CSV unquoting and before ASCII trim of x/y",
    "prediction_model_bytes_max_inclusive": 1048576,
    "limit_plus_one_result": "INPUT_LIMIT_EXCEEDED before any solver call",
    "malformed_row_policy": "malformed CSV is file-level failure; a grammar-invalid x or y in a structurally valid record is skipped with audit"
  },
  "identity_policy": {
    "policy_id": "canonical-hash-json-v1",
    "projection_policy_path": "docs/acceptance/identity-policy-v1.json",
    "projection_policy_sha256": "e4638c2d83ab910b7716ac3a7f2d74fe5fad899f08cb1ab63dc603a028545525",
    "split_policy_path": "docs/acceptance/split-policy-v1.json",
    "split_policy_sha256": "6466c9aeb9a78804831998ef7cd0bcfad0693feedf7a2e5c8f4c940568677b2e",
    "serialization": "UTF-8 JSON with object keys sorted by Unicode scalar value, compact separators, arrays in semantic order and no duplicate keys or non-finite numbers",
    "unicode": "NFC-normalize result-bearing text metadata; logical row_id remains exact CSV text and raw input bytes remain protected by input_sha256",
    "float_encoding": "replace every binary64 in a hash payload by tagged string f64:<16 lowercase big-endian IEEE-754 hex digits>; normalize -0 to +0",
    "integer_encoding": "unbounded canonical base-10 JSON integer without leading zero",
    "hash": "SHA-256 of canonical UTF-8 bytes",
    "analysis_projection": [
      "raw input SHA-256",
      "logical adapter version",
      "canonical units and result-bearing request metadata",
      "resolved policy/registry/solver payloads",
      "source artifact manifest SHA-256",
      "dependency lock SHA-256",
      "base seed and seed-derivation version",
      "LLM advisor mode/config/prompt/schema and frozen accepted-or-fallback ledger SHA-256 when enabled"
    ],
    "analysis_exclusions": [
      "output/work paths",
      "report_id",
      "generated_at",
      "elapsed time",
      "RSS",
      "presentation-only warnings",
      "filesystem metadata",
      "LLM access token and raw base URL"
    ],
    "same_environment_exact_fields": [
      "analysis_id",
      "split IDs",
      "task IDs",
      "statuses",
      "decision state",
      "recommendation",
      "membership cell",
      "model_structure_hash",
      "model_instance_hash",
      "canonical recommended-model JSON"
    ]
  },
  "numeric_policy": {
    "policy_id": "numeric-acceptance-v1",
    "low_x_resolution_warn_if_ratio_gt": 0.000001,
    "normalized_x_collision": "fail closed with NONINVERTIBLE_X_SCALE and NORMALIZED_X_COLLISION before solver",
    "collapse_prediction_scaled_y_max_abs": 0.000001,
    "collapse_derivative_scaled_y_per_t_max_abs": 0.000001,
    "condition_warning_if_gt": 100000000,
    "weak_identifiability_if_gt": 1000000000000,
    "rank_deficiency": "always RANK_FAILURE",
    "selection_tie_relative_pooled_mse": 0.01,
    "technical_objective_tie": "max(1e-12, 1e-10*max(1, abs(best_sse_scaled)))",
    "near_optimum_sse": "max(1e-8, 0.01*max(best_sse_scaled, 1e-8))",
    "multiple_breakpoint_spread_normalized_gt": 0.15,
    "join_scaled_y": "1e-10*max(1, abs(mu_scaled))",
    "independent_evaluator_scaled_y": "1e-10*max(1, max_abs_prediction_scaled)",
    "boundary_hit_normalized_distance_lte": 0.000001,
    "same_platform_prediction": "bit-identical canonical model and semantic result",
    "cross_platform_prediction_scaled_y_max_abs": 0.0000001,
    "cross_platform_breakpoint_normalized_max_abs": 0.000001,
    "cross_platform_parameter_scaled": "abs(a-b) <= 1e-6*max(1,abs(a),abs(b)) for every canonical scaled parameter with identical parameter names/order",
    "cross_platform_rmse_mae": "if max(abs(a),abs(b)) <= 1e-12*y_scale require abs(a-b) <= 1e-12*y_scale; otherwise require abs(a-b) <= max(1e-8*y_scale,1e-6*max(abs(a),abs(b)))",
    "cross_platform_r2_uplift_max_abs": 0.000001,
    "cross_platform_decision_guard": "threshold-near fixtures must preserve the exact decision; any tolerance crossing is a failure, not an allowed ambiguity",
    "formula_plot_original_y": "max(1e-10*max(1,y_scale), 8*ulp(expected))"
  },
  "simulation_policy": {
    "policy_id": "simulation-operating-characteristics-v1",
    "replicates_per_operating_cell": 200,
    "seed_derivation": "SHA-256 namespace acceptance-v1/<fixture-id>/<cell-id>/<replicate-index>, first unsigned 64 bits",
    "p1_null_or_weak_selected_rate_min": 0.9,
    "false_p2_rate_max": 0.05,
    "strong_p2_selected_rate_min": 0.8,
    "strong_p2_wilson95_lower_min": 0.75,
    "no_uplift_clear_p2_wilson95_upper_max": 0.1,
    "noiseless_prediction_scaled_y_max_abs": 0.00001,
    "identified_breakpoint_median_normalized_error_max": 0.05,
    "identified_breakpoint_p90_normalized_error_max": 0.1,
    "clean_residual_row_false_flag_rate_max": 0.02,
    "injected_6scale_residual_detection_rate_min": 0.8,
    "clean_influence_false_flag_rate_max": 0.1,
    "known_influence_detection_rate_min": 0.8,
    "bootstrap_defined_min_of_200": 160,
    "full_fallback_relative_uplift": 0.0,
    "zero_p1_mse_relative_effect": "null with ZERO_P1_MSE",
    "bootstrap_duplicate_group_rule": "sample G canonical x-group IDs with replacement and aggregate their already frozen paired outer-OOF loss contributions with multiplicity; no rows are refit or predicted inside bootstrap",
    "bootstrap_defined_rule": "a resample is defined exactly when its aggregated P1 MSE is positive and both paired loss sums are finite; otherwise it is null with ZERO_P1_MSE or NONFINITE_BOOTSTRAP_LOSS; at least 160 of 200 defined effects are required"
  },
  "work_policy": {
    "policy_id": "work-policy-v1",
    "path": "docs/acceptance/work-policy-v1.json",
    "sha256": "6b2f6a545b9b2310897e19d6b918a82e1a38072e3cd0ba372e6a90c571d90005"
  },
  "source_inventory_policy": {
    "policy_id": "monotone-calibrate-source-inventory-v1",
    "path": "docs/acceptance/source-inventory-policy-v1.json",
    "sha256": "2fc9f2d631ced54db42e7ad29ffcc48e11c473c19274e12f0279abcf120b0953",
    "schema_path": "docs/acceptance/source-inventory-policy.schema.json",
    "schema_sha256": "7f10302c89318675ddec7ecd8f0ede275b4c9c7907ebef1f06f42e1c4039fb19"
  },
  "source_snapshot_policy": {
    "policy_id": "canonical-source-zip-v1",
    "path": "evidence/acceptance/source-snapshot.zip",
    "builder": "tools/build_source_snapshot.py",
    "authority": "the signed content-addressed ZIP is the release source artifact; the live checkout is a non-authoritative materialization checked only as defense in depth",
    "members": "exact bytewise-sorted source-manifest file list; no directory, duplicate, missing or extra member",
    "encoding": "ZIP_STORED only, Unix regular mode 0644, 1980-01-01T00:00:00 tuple, empty archive/member comments and extra fields, no encryption/data descriptor/unknown flag bits",
    "bounds": "source-inventory-v1 per-file/count/uncompressed-total limits apply before and during member reads; compressed size equals uncompressed size",
    "binding": "source_manifest.source_archive_sha256, acceptance results, every gate evidence record, numerical environment identity and reviewed evidence preimage all bind the exact archive SHA-256",
    "mutation_semantics": "post-verification mutation of a path cannot change the signed artifact identity; consumers materialize only archive bytes matching the accepted SHA-256"
  },
  "gate_execution_policy": {
    "policy_id": "monotone-calibrate-gate-execution-v1",
    "path": "docs/acceptance/gate-execution-policy-v1.json",
    "sha256": "5e58937a0df98a32a678aa590b44d35c7fb8b15f74fe34c20a7f31343849053d",
    "schema_path": "docs/acceptance/gate-execution-policy.schema.json",
    "schema_sha256": "f55d064377eba3c63d833b43a64c4e57cc23ced985b916c4265c0bb2fd472dde"
  },
  "release_anchor_policy": {
    "policy_id": "external-normative-snapshot-anchor-v1",
    "caller_input": "mandatory --trusted-release-digest with a 64-character lowercase SHA-256 obtained out of band from the accepted release handoff",
    "ledger": "bytewise path-sorted unique <workspace-relative path> TAB <byte size> TAB <file SHA-256> LF over every non-symlink regular file under docs/acceptance except evidence/__pycache__/*.pyc, plus the exact specification 01..08 Markdown files and six named specification schemas",
    "verification_order": "the descriptor-safe ledger is hashed and compared with the caller anchor before any project-local schema, results or evidence is loaded",
    "signed_binding": "release_snapshot_digest is present in acceptance results, every gate evidence record, the reviewed evidence preimage and both Ed25519 signed reviewer payloads",